{
  "schema_version": "1.0.0",
  "generated_at": "2026-06-24T03:53:46.611Z",
  "source_messages": "D:/Code/MyGitRepos/Settle/tools/telegram-export/exports/general/messages.jsonl",
  "method": "ask_frequency = count of question-like source messages matching >=2 probe terms (1 if a single probe) derived from each answer-card RU title; counts overlap across cards (relative-demand signal). See scripts/build-questions.mjs.",
  "count": 85,
  "questions": [
    {
      "question_id": "q.faq_banking.q03_what_is_prex",
      "answer_card_id": "card.faq_banking.q03_what_is_prex",
      "topic_id": "topic.faq_banking",
      "ask_frequency": 472,
      "locales": {
        "ru": [
          "Что такое Prex и зачем он нужен?"
        ],
        "en": [
          "What is Prex and why would I need it?"
        ],
        "es": [
          "¿Qué es Prex y para qué sirve?"
        ],
        "de": [
          "Was ist Prex und wozu brauche ich es?"
        ]
      }
    },
    {
      "question_id": "q.faq_transport.q08_car_taxes",
      "answer_card_id": "card.faq_transport.q08_car_taxes",
      "topic_id": "topic.faq_transport",
      "ask_frequency": 241,
      "locales": {
        "ru": [
          "Сколько стоит налог на машину (patente) и как платить?"
        ],
        "en": [
          "How much is the car tax (patente) and how do I pay?"
        ],
        "es": [
          "¿Cuánto cuesta la patente del auto y cómo se paga?"
        ],
        "de": [
          "Wie hoch ist die Kfz-Steuer (patente) und wie zahle ich?"
        ]
      }
    },
    {
      "question_id": "q.faq_taxes.q03_personal_taxes",
      "answer_card_id": "card.faq_taxes.q03_personal_taxes",
      "topic_id": "topic.faq_taxes",
      "ask_frequency": 212,
      "locales": {
        "ru": [
          "Какие налоги платит физлицо в Уругвае?"
        ],
        "en": [
          "What taxes does an individual pay in Uruguay?"
        ],
        "es": [
          "¿Qué impuestos paga una persona física en Uruguay?"
        ],
        "de": [
          "Welche Steuern zahlt eine Privatperson in Uruguay?"
        ]
      }
    },
    {
      "question_id": "q.faq_banking.q02_which_bank",
      "answer_card_id": "card.faq_banking.q02_which_bank",
      "topic_id": "topic.faq_banking",
      "ask_frequency": 201,
      "locales": {
        "ru": [
          "Какой банк выбрать: Itaú, Santander, BROU?"
        ],
        "en": [
          "Which bank should I choose: Itaú, Santander or BROU?"
        ],
        "es": [
          "¿Qué banco elegir: Itaú, Santander o BROU?"
        ],
        "de": [
          "Welche Bank wählen: Itaú, Santander oder BROU?"
        ]
      }
    },
    {
      "question_id": "q.faq_banking.q05_transfer_money",
      "answer_card_id": "card.faq_banking.q05_transfer_money",
      "topic_id": "topic.faq_banking",
      "ask_frequency": 177,
      "locales": {
        "ru": [
          "Как перевести деньги в Уругвай и обратно?"
        ],
        "en": [
          "How do I move money into and out of Uruguay?"
        ],
        "es": [
          "¿Cómo traigo y saco dinero de Uruguay?"
        ],
        "de": [
          "Wie bringe ich Geld nach Uruguay und wieder heraus?"
        ]
      }
    },
    {
      "question_id": "q.faq_banking.q01_open_account",
      "answer_card_id": "card.faq_banking.q01_open_account",
      "topic_id": "topic.faq_banking",
      "ask_frequency": 160,
      "locales": {
        "ru": [
          "Как открыть банковский счёт в Уругвае?"
        ],
        "en": [
          "How do I open a bank account in Uruguay?"
        ],
        "es": [
          "¿Cómo abro una cuenta bancaria en Uruguay?"
        ],
        "de": [
          "Wie eröffne ich ein Bankkonto in Uruguay?"
        ]
      }
    },
    {
      "question_id": "q.faq_money_crypto.q01_transfer",
      "answer_card_id": "card.faq_money_crypto.q01_transfer",
      "topic_id": "topic.faq_money_crypto",
      "ask_frequency": 126,
      "locales": {
        "ru": [
          "Как перевести деньги в Уругвай?"
        ],
        "en": [
          "How do I send money to Uruguay?"
        ],
        "es": [
          "¿Cómo envío dinero a Uruguay?"
        ],
        "de": [
          "Wie überweise ich Geld nach Uruguay?"
        ]
      }
    },
    {
      "question_id": "q.faq_work.q01_find_job",
      "answer_card_id": "card.faq_work.q01_find_job",
      "topic_id": "topic.faq_work",
      "ask_frequency": 124,
      "locales": {
        "ru": [
          "Легко ли найти работу в Уругвае?"
        ],
        "en": [
          "Is it easy to find work in Uruguay?"
        ],
        "es": [
          "¿Es fácil encontrar trabajo en Uruguay?"
        ],
        "de": [
          "Ist es leicht, in Uruguay Arbeit zu finden?"
        ]
      }
    },
    {
      "question_id": "q.faq_locations.q01_which_neighbourhood",
      "answer_card_id": "card.faq_locations.q01_which_neighbourhood",
      "topic_id": "topic.faq_locations",
      "ask_frequency": 114,
      "locales": {
        "ru": [
          "В каком районе лучше жить и какие безопасные?"
        ],
        "en": [
          "Which neighbourhood is best and which are safe?"
        ],
        "es": [
          "¿Qué barrio es mejor y cuáles son seguros?"
        ],
        "de": [
          "Welches Viertel ist am besten und welche sind sicher?"
        ]
      }
    },
    {
      "question_id": "q.faq_taxes.q05_worldwide_income",
      "answer_card_id": "card.faq_taxes.q05_worldwide_income",
      "topic_id": "topic.faq_taxes",
      "ask_frequency": 112,
      "locales": {
        "ru": [
          "Облагается ли мировой доход в Уругвае?"
        ],
        "en": [
          "Is worldwide income taxed in Uruguay?"
        ],
        "es": [
          "¿Se grava la renta mundial en Uruguay?"
        ],
        "de": [
          "Wird das Welteinkommen in Uruguay besteuert?"
        ]
      }
    },
    {
      "question_id": "q.faq_money_crypto.q04_wise",
      "answer_card_id": "card.faq_money_crypto.q04_wise",
      "topic_id": "topic.faq_money_crypto",
      "ask_frequency": 103,
      "locales": {
        "ru": [
          "Работает ли Wise в Уругвае?"
        ],
        "en": [
          "Does Wise work in Uruguay?"
        ],
        "es": [
          "¿Funciona Wise en Uruguay?"
        ],
        "de": [
          "Funktioniert Wise in Uruguay?"
        ]
      }
    },
    {
      "question_id": "q.faq_documents.q04_no_criminal_record",
      "answer_card_id": "card.faq_documents.q04_no_criminal_record",
      "topic_id": "topic.faq_documents",
      "ask_frequency": 95,
      "locales": {
        "ru": [
          "Как получить справку о несудимости для резиденции?"
        ],
        "en": [
          "How do I get a police-clearance certificate for residency?"
        ],
        "es": [
          "¿Cómo obtengo el certificado de antecedentes para la residencia?"
        ],
        "de": [
          "Wie bekomme ich ein Führungszeugnis für den Aufenthalt?"
        ]
      }
    },
    {
      "question_id": "q.faq_residency.q06_cedula_legal_tramite",
      "answer_card_id": "card.faq_residency.q06_cedula_legal_tramite",
      "topic_id": "topic.faq_residency",
      "ask_frequency": 89,
      "locales": {
        "ru": [
          "Что значат cédula «legal» и «en trámite»?"
        ],
        "en": [
          "What do cédula 'legal' and 'en trámite' mean?"
        ],
        "es": [
          "¿Qué significan cédula «legal» y «en trámite»?"
        ],
        "de": [
          "Was bedeuten Cédula „legal\" und „en trámite\"?"
        ]
      }
    },
    {
      "question_id": "q.faq_health.q06_unavailable_meds",
      "answer_card_id": "card.faq_health.q06_unavailable_meds",
      "topic_id": "topic.faq_health",
      "ask_frequency": 83,
      "locales": {
        "ru": [
          "Каких лекарств может не быть и чем их заменить?"
        ],
        "en": [
          "Which medicines may be missing and how do I replace them?"
        ],
        "es": [
          "¿Qué medicamentos pueden faltar y con qué reemplazarlos?"
        ],
        "de": [
          "Welche Medikamente könnten fehlen und wie ersetze ich sie?"
        ]
      }
    },
    {
      "question_id": "q.faq_documents.q01_what_to_apostille",
      "answer_card_id": "card.faq_documents.q01_what_to_apostille",
      "topic_id": "topic.faq_documents",
      "ask_frequency": 82,
      "locales": {
        "ru": [
          "Какие документы апостилировать перед переездом?"
        ],
        "en": [
          "Which documents should I apostille before moving?"
        ],
        "es": [
          "¿Qué documentos apostillar antes de mudarme?"
        ],
        "de": [
          "Welche Dokumente vor dem Umzug apostillieren?"
        ]
      }
    },
    {
      "question_id": "q.faq_safety.q03_notary_income",
      "answer_card_id": "card.faq_safety.q03_notary_income",
      "topic_id": "topic.faq_safety",
      "ask_frequency": 78,
      "locales": {
        "ru": [
          "Зачем нужен нотариус (escribano) и сертификат о доходах?"
        ],
        "en": [
          "Why do I need a notary (escribano) and an income certificate?"
        ],
        "es": [
          "¿Para qué sirve el escribano y la certificación de ingresos?"
        ],
        "de": [
          "Wozu brauche ich einen Notar (escribano) und eine Einkommensbescheinigung?"
        ]
      }
    },
    {
      "question_id": "q.faq_transport.q01_driving_licence",
      "answer_card_id": "card.faq_transport.q01_driving_licence",
      "topic_id": "topic.faq_transport",
      "ask_frequency": 77,
      "locales": {
        "ru": [
          "Нужны ли местные водительские права и как их получить?"
        ],
        "en": [
          "Do I need a local driving licence and how do I get it?"
        ],
        "es": [
          "¿Necesito licencia de conducir local y cómo la saco?"
        ],
        "de": [